### ISSUE TITLE
imtcp retrieves connection while imptcp does not

### ISSUE THREAD

**Issue by skupkosk** [rsyslog/rsyslog#3728]
### Expected behavior
The logger's TCP connection should be retrieved by rsyslog and logged to file.

### Actual behavior
The TCP connection is not retrieved by rsyslog while used imptcp for listening for TCP connections. The imtcp retrieved the conenction just fine.

### Steps to reproduce the behavior
Simple LVS setup with one node only.

### Environment
- rsyslog version: 8.1901
- platform: Debian10

**Comment by skupkosk** [comment]
#This just confirm the request https://github.com/rsyslog/rsyslog/issues/3727 does make sense and there are differences how imtcp and imptcp handle connections.

**Comment by skupkosk** [comment]
### IMTCP plain session on 
**host IP**
```
tcpdump: verbose output suppressed, use -v or -vv for full protocol decode
listening on eth0, link-type EN10MB (Ethernet), capture size 262144 bytes
15:38:34.293010 IP 10.0.x.b.39918 > 10.0.x.a.5514: Flags [S], seq 329979279, win 29200, options [mss 1460,sackOK,TS val 4291096856 ecr 0,nop,wscale 7], length 0
E..<Z9@.@...
..p
..o..............r.#}.........
............
15:38:34.293929 IP 10.0.x.b.39918 > 10.0.x.a.5514: Flags [.], ack 4235449100, win 229, options [nop,nop,TS val 4291096856 ecr 1444120505], length 0
E..4Z:@.@...
..p
..o.........s.............
....V...
15:38:34.293960 IP 10.0.x.b.39918 > 10.0.x.a.5514: Flags [P.], seq 0:172, ack 1, win 229, options [nop,nop,TS val 4291096856 ecr 1444120505], length 172
E...Z;@.@...
..p
..o.........s.............
....V...<13>1 2019-06-28T15:38:34.291650+02:00 HOST-LOCO3 testtcp 14097 - [timeQuality tzKnown="1" isSynced="1" syncAccuracy="544627"] testing message very very long 1561729114

15:38:34.293973 IP 10.0.x.b.39918 > 10.0.x.a.5514: Flags [F.], seq 172, ack 1, win 229, options [nop,nop,TS val 4291096856 ecr 1444120505], length 0
E..4Z<@.@...
..p
..o.......<.s.......j.....
....V...
15:38:34.295436 IP 10.0.x.b.39918 > 10.0.x.a.5514: Flags [.], ack 2, win 229, options [nop,nop,TS val 4291096858 ecr 1444120506], length 0
E..4Z=@.@...
..p
..o.......=.s.......f.....
....V...
^C
5 packets captured
5 packets received by filter
0 packets dropped by kernel
```
**cluster IP**
```
tcpdump: verbose output suppressed, use -v or -vv for full protocol decode
listening on eth0, link-type EN10MB (Ethernet), capture size 262144 bytes
15:39:36.657659 IP 10.0.x.b.40334 > 10.1.233.113.5514: Flags [S], seq 689539029, win 29200, options [mss 1460,sackOK,TS val 2679546200 ecr 0,nop,wscale 7], length 0
E..<.H@.@.H.
..p
..q....).........r.I..........
...X........
15:39:36.658809 IP 10.0.x.b.40334 > 10.1.233.113.5514: Flags [.], ack 2216787217, win 229, options [nop,nop,TS val 2679546201 ecr 2445902688], length 0
E..4.I@.@.H.
..p
..q....)....!}......~.....
...Y...`
15:39:36.658865 IP 10.0.x.b.40334 > 10.1.233.113.5514: Flags [P.], seq 0:172, ack 1, win 229, options [nop,nop,TS val 2679546201 ecr 2445902688], length 172
E....J@.@.G.
..p
..q....)....!}............
...Y...`<13>1 2019-06-28T15:39:36.656676+02:00 HOST-LOCO3 testtcp 14099 - [timeQuality tzKnown="1" isSynced="1" syncAccuracy="575627"] testing message very very long 1561729176

15:39:36.658893 IP 10.0.x.b.40334 > 10.1.233.113.5514: Flags [F.], seq 172, ack 1, win 229, options [nop,nop,TS val 2679546201 ecr 2445902688], length 0
E..4.K@.@.H.
..p
..q....)....!}............
...Y...`
15:39:36.659394 IP 10.0.x.b.40334 > 10.1.233.113.5514: Flags [.], ack 2, win 229, options [nop,nop,TS val 2679546202 ecr 2445902689], length 0
E..4.L@.@.H.
..p
..q....)....!}............
...Z...a
^C
5 packets captured
5 packets received by filter
0 packets dropped by kernel
```

**Comment by davidelang** [comment]
check iptables, I've seen cases where you see the data with tcpdump, but 
iptables blocks the packets before they get to rsyslog

David Lang

**Comment by rgerhards** [comment]
I am sorry, I do not understand the meaning of this issue. What does "retrieve" in this context mean?

**Comment by skupkosk** [comment]
**Seems to be not related to HA setup.**
Just tested receive on imptcp on standalone Debian 10 and seems to be not working either.
Strace outputs from remote message processing (with same rsyslog configuration without rulesets, just imtcp/imptcp listen ports changed):
```
	
strace: Process 5966 attached with 9 threads
[pid  5967] restart_syscall(<... resuming interrupted poll ...> <unfinished ...>
[pid  5974] futex(0x7f962b6f4858, FUTEX_WAIT_PRIVATE, 0, NULL <unfinished ...>
[pid  5973] futex(0x7f962b6f4858, FUTEX_WAIT_PRIVATE, 0, NULL <unfinished ...>
[pid  5972] futex(0x55a9e6348e30, FUTEX_WAIT_PRIVATE, 0, NULL <unfinished ...>
[pid  5971] select(0, NULL, NULL, NULL, {tv_sec=500, tv_usec=356841} <unfinished ...>
[pid  5970] epoll_wait(8,  <unfinished ...>
[pid  5969] select(0, NULL, NULL, NULL, {tv_sec=1100, tv_usec=351195} <unfinished ...>
[pid  5968] read(7,  <unfinished ...>
[pid  5966] select(1, NULL, NULL, NULL, {tv_sec=500, tv_usec=351528} <unfinished ...>
[pid  5970] <... epoll_wait resumed> [{EPOLLIN, {u32=3862198096, u64=94188200032080}}], 128, -1) = 1
[pid  5970] accept(9, {sa_family=AF_INET, sin_port=htons(36453), sin_addr=inet_addr("10.0.x.z")}, [128->16]) = 16
[pid  5970] stat("/etc/resolv.conf", {st_mode=S_IFREG|0644, st_size=42, ...}) = 0
[pid  5970] openat(AT_FDCWD, "/etc/hosts", O_RDONLY|O_CLOEXEC) = 17
[pid  5970] lseek(17, 0, SEEK_CUR)      = 0
[pid  5970] fstat(17, {st_mode=S_IFREG|0644, st_size=252, ...}) = 0
[pid  5970] read(17, "127.0.0.1\tlocalhost\n10.0.x.a"..., 4096) = 252
[pid  5970] lseek(17, 0, SEEK_CUR)      = 252
[pid  5970] read(17, "", 4096)          = 0
[pid  5970] close(17)                   = 0
[pid  5970] socket(AF_INET, SOCK_DGRAM|SOCK_CLOEXEC|SOCK_NONBLOCK, IPPROTO_IP) = 17
[pid  5970] connect(17, {sa_family=AF_INET, sin_port=htons(53), sin_addr=inet_addr("10.0.x.s")}, 16) = 0
[pid  5970] poll([{fd=17, events=POLLOUT}], 1, 0) = 1 ([{fd=17, revents=POLLOUT}])
[pid  5970] sendto(17, "\254V\1\0\0\1\0\0\0\0\0\0\001z\003x\0010\00210\7in-addr\4"..., 41, MSG_NOSIGNAL, NULL, 0) = 41
[pid  5970] poll([{fd=17, events=POLLIN}], 1, 5000) = 1 ([{fd=17, revents=POLLIN}])
[pid  5970] ioctl(17, FIONREAD, [100])  = 0
[pid  5970] recvfrom(17, "\254V\201\203\0\1\0\0\0\1\0\0\001z\003x\0010\00210\7in-addr\4"..., 1024, 0, {sa_family=AF_INET, sin_port=htons(53), sin_addr=inet_addr("10.0.x.s")}, [28->16]) = 100
[pid  5970] close(17)                   = 0
[pid  5970] fcntl(16, F_GETFL)          = 0x2 (flags O_RDWR)
[pid  5970] fcntl(16, F_SETFL, O_RDWR|O_NONBLOCK) = 0
[pid  5970] epoll_ctl(8, EPOLL_CTL_ADD, 16, {EPOLLIN|EPOLLONESHOT|EPOLLET, {u32=536879440, u64=140282758701392}}) = 0
[pid  5970] accept(9, 0x7f962aa19640, [128]) = -1 EAGAIN (Resource temporarily unavailable)
[pid  5970] epoll_ctl(8, EPOLL_CTL_MOD, 9, {EPOLLIN|EPOLLONESHOT|EPOLLET, {u32=3862198096, u64=94188200032080}}) = 0
[pid  5970] epoll_wait(8, [{EPOLLIN, {u32=536879440, u64=140282758701392}}], 128, -1) = 1
[pid  5970] recvfrom(16, "<5>Jul  1 09:53:35 testtcp[25901"..., 131072, 0, NULL, NULL) = 84
[pid  5970] recvfrom(16, "", 131072, 0, NULL, NULL) = 0
[pid  5970] close(16)                   = 0
[pid  5970] epoll_wait(8,  <unfinished ...>
###### EOF IMPTCP strace
```
The imtcp output is much longer
###### IMTCP strace
```
strace: Process 6325 attached with 11 threads
[pid  6334] futex(0x7f9f086cad00, FUTEX_WAIT_PRIVATE, 0, NULL <unfinished ...>
[pid  6335] futex(0x7f9f086cad68, FUTEX_WAIT_PRIVATE, 0, NULL <unfinished ...>
[pid  6332] futex(0x7f9f086cac30, FUTEX_WAIT_PRIVATE, 0, NULL <unfinished ...>
[pid  6333] futex(0x7f9f086cac98, FUTEX_WAIT_PRIVATE, 0, NULL <unfinished ...>
[pid  6330] futex(0x55a70ee825d4, FUTEX_WAIT_PRIVATE, 0, NULL <unfinished ...>
[pid  6331] select(0, NULL, NULL, NULL, {tv_sec=578, tv_usec=995366} <unfinished ...>
[pid  6329] epoll_wait(11,  <unfinished ...>
[pid  6328] select(0, NULL, NULL, NULL, {tv_sec=1178, tv_usec=995881} <unfinished ...>
[pid  6327] read(7,  <unfinished ...>
[pid  6325] select(1, NULL, NULL, NULL, {tv_sec=578, tv_usec=995046} <unfinished ...>
[pid  6326] restart_syscall(<... resuming interrupted poll ...> <unfinished ...>
[pid  6329] <... epoll_wait resumed> [{EPOLLIN, {u32=4026536208, u64=140320608096528}}], 128, -1) = 1
[pid  6329] accept(8, {sa_family=AF_INET, sin_port=htons(36463), sin_addr=inet_addr("10.0.x.z")}, [128->16]) = 15
[pid  6329] rt_sigprocmask(SIG_BLOCK, [HUP], ~[KILL SEGV STOP TTIN RTMIN RT_1], 8) = 0
[pid  6329] stat("/etc/resolv.conf", {st_mode=S_IFREG|0644, st_size=42, ...}) = 0
[pid  6329] openat(AT_FDCWD, "/etc/hosts", O_RDONLY|O_CLOEXEC) = 16
[pid  6329] lseek(16, 0, SEEK_CUR)      = 0
[pid  6329] fstat(16, {st_mode=S_IFREG|0644, st_size=252, ...}) = 0
[pid  6329] read(16, "127.0.0.1\tlocalhost\n10.0.x.a"..., 4096) = 252
[pid  6329] lseek(16, 0, SEEK_CUR)      = 252
[pid  6329] read(16, "", 4096)          = 0
[pid  6329] close(16)                   = 0
[pid  6329] openat(AT_FDCWD, "/etc/ld.so.cache", O_RDONLY|O_CLOEXEC) = 16
[pid  6329] fstat(16, {st_mode=S_IFREG|0644, st_size=45398, ...}) = 0
[pid  6329] mmap(NULL, 45398, PROT_READ, MAP_PRIVATE, 16, 0) = 0x7f9f059d8000
[pid  6329] close(16)                   = 0
[pid  6329] openat(AT_FDCWD, "/lib/x86_64-linux-gnu/libnss_dns.so.2", O_RDONLY|O_CLOEXEC) = 16
[pid  6329] read(16, "\177ELF\2\1\1\0\0\0\0\0\0\0\0\0\3\0>\0\1\0\0\0\300\21\0\0\0\0\0\0"..., 832) = 832
[pid  6329] fstat(16, {st_mode=S_IFREG|0644, st_size=26960, ...}) = 0
[pid  6329] mmap(NULL, 28896, PROT_READ, MAP_PRIVATE|MAP_DENYWRITE, 16, 0) = 0x7f9f059d0000
[pid  6329] mmap(0x7f9f059d1000, 16384, PROT_READ|PROT_EXEC, MAP_PRIVATE|MAP_FIXED|MAP_DENYWRITE, 16, 0x1000) = 0x7f9f059d1000
[pid  6329] mmap(0x7f9f059d5000, 4096, PROT_READ, MAP_PRIVATE|MAP_FIXED|MAP_DENYWRITE, 16, 0x5000) = 0x7f9f059d5000
[pid  6329] mmap(0x7f9f059d6000, 8192, PROT_READ|PROT_WRITE, MAP_PRIVATE|MAP_FIXED|MAP_DENYWRITE, 16, 0x5000) = 0x7f9f059d6000
[pid  6329] close(16)                   = 0
[pid  6329] openat(AT_FDCWD, "/lib/x86_64-linux-gnu/libresolv.so.2", O_RDONLY|O_CLOEXEC) = 16
[pid  6329] read(16, "\177ELF\2\1\1\0\0\0\0\0\0\0\0\0\3\0>\0\1\0\0\0\240C\0\0\0\0\0\0"..., 832) = 832
[pid  6329] fstat(16, {st_mode=S_IFREG|0644, st_size=93000, ...}) = 0
[pid  6329] mmap(NULL, 105088, PROT_READ, MAP_PRIVATE|MAP_DENYWRITE, 16, 0) = 0x7f9f059b6000
[pid  6329] mprotect(0x7f9f059ba000, 73728, PROT_NONE) = 0
[pid  6329] mmap(0x7f9f059ba000, 53248, PROT_READ|PROT_EXEC, MAP_PRIVATE|MAP_FIXED|MAP_DENYWRITE, 16, 0x4000) = 0x7f9f059ba000
[pid  6329] mmap(0x7f9f059c7000, 16384, PROT_READ, MAP_PRIVATE|MAP_FIXED|MAP_DENYWRITE, 16, 0x11000) = 0x7f9f059c7000
[pid  6329] mmap(0x7f9f059cc000, 8192, PROT_READ|PROT_WRITE, MAP_PRIVATE|MAP_FIXED|MAP_DENYWRITE, 16, 0x15000) = 0x7f9f059cc000
[pid  6329] mmap(0x7f9f059ce000, 6784, PROT_READ|PROT_WRITE, MAP_PRIVATE|MAP_FIXED|MAP_ANONYMOUS, -1, 0) = 0x7f9f059ce000
[pid  6329] close(16)                   = 0
[pid  6329] mprotect(0x7f9f059cc000, 4096, PROT_READ) = 0
[pid  6329] mprotect(0x7f9f059d6000, 4096, PROT_READ) = 0
[pid  6329] munmap(0x7f9f059d8000, 45398) = 0
[pid  6329] socket(AF_INET, SOCK_DGRAM|SOCK_CLOEXEC|SOCK_NONBLOCK, IPPROTO_IP) = 16
[pid  6329] connect(16, {sa_family=AF_INET, sin_port=htons(53), sin_addr=inet_addr("10.0.x.s")}, 16) = 0
[pid  6329] poll([{fd=16, events=POLLOUT}], 1, 0) = 1 ([{fd=16, revents=POLLOUT}])
[pid  6329] sendto(16, "\324\375\1\0\0\1\0\0\0\0\0\0\001z\003x\0010\00210\7in-addr\4"..., 41, MSG_NOSIGNAL, NULL, 0) = 41
[pid  6329] poll([{fd=16, events=POLLIN}], 1, 5000) = 1 ([{fd=16, revents=POLLIN}])
[pid  6329] ioctl(16, FIONREAD, [100])  = 0
[pid  6329] recvfrom(16, "\324\375\201\203\0\1\0\0\0\1\0\0\001z\003x\0010\00210\7in-addr\4"..., 1024, 0, {sa_family=AF_INET, sin_port=htons(53), sin_addr=inet_addr("10.0.x.s")}, [28->16]) = 100
[pid  6329] close(16)                   = 0
[pid  6329] rt_sigprocmask(SIG_SETMASK, ~[KILL SEGV STOP TTIN RTMIN RT_1], NULL, 8) = 0
[pid  6329] fcntl(15, F_GETFL)          = 0x2 (flags O_RDWR)
[pid  6329] fcntl(15, F_SETFL, O_RDWR|O_NONBLOCK) = 0
[pid  6329] epoll_ctl(11, EPOLL_CTL_ADD, 15, {EPOLLIN, {u32=4026545552, u64=140320608105872}}) = 0
[pid  6329] epoll_wait(11, [{EPOLLIN, {u32=4026545552, u64=140320608105872}}], 128, -1) = 1
[pid  6329] recvfrom(15, "<5>Jul  1 09:56:45 testtcp[25903"..., 131072, MSG_DONTWAIT, NULL, NULL) = 84
[pid  6329] epoll_wait(11, [{EPOLLIN, {u32=4026545552, u64=140320608105872}}], 128, -1) = 1
[pid  6329] recvfrom(15, "", 131072, MSG_DONTWAIT, NULL, NULL) = 0
[pid  6329] epoll_ctl(11, EPOLL_CTL_DEL, 15, 0x7f9ef0003590) = 0
[pid  6329] futex(0x55a70ee825d4, FUTEX_WAKE_PRIVATE, 1 <unfinished ...>
[pid  6330] <... futex resumed> )       = 0
[pid  6329] <... futex resumed> )       = 1
[pid  6330] futex(0x55a70ee82080, FUTEX_WAIT_PRIVATE, 2, NULL <unfinished ...>
[pid  6329] futex(0x55a70ee82080, FUTEX_WAKE_PRIVATE, 1 <unfinished ...>
[pid  6330] <... futex resumed> )       = 0
[pid  6329] <... futex resumed> )       = 1
[pid  6330] futex(0x55a70ee82080, FUTEX_WAKE_PRIVATE, 1) = 0
[pid  6329] close(15 <unfinished ...>
[pid  6330] write(12, "Jul  1 09:56:45 10.0.x.z testt"..., 92 <unfinished ...>
[pid  6329] <... close resumed> )       = 0
[pid  6330] <... write resumed> )       = 92
[pid  6329] epoll_wait(11,  <unfinished ...>
[pid  6330] access("/var/log/kern.log", F_OK) = 0
[pid  6330] openat(AT_FDCWD, "/var/log/kern.log", O_WRONLY|O_CREAT|O_NOCTTY|O_APPEND|O_CLOEXEC, 0640) = 15
[pid  6330] ioctl(15, TCGETS, 0x7f9f075e86d0) = -1 ENOTTY (Inappropriate ioctl for device)
[pid  6330] stat("/var/log/kern.log", {st_mode=S_IFREG|0640, st_size=546, ...}) = 0
[pid  6330] write(15, "Jul  1 09:56:45 10.0.x.z testt"..., 92) = 92
[pid  6330] futex(0x55a70ee825d0, FUTEX_WAIT_PRIVATE, 0, NULL
###### EOF IMTCP strace
```
Configuration:
rsyslog.conf
```
:~# awk '!/^#|^\s+#|^$/' /etc/rsyslog.conf
$ModLoad imuxsock # provides support for local system logging
$ModLoad imklog   # provides kernel logging support (previously done by rklogd)
$ModLoad immark  # provides --MARK-- message capability
$LocalHostName HOST-LOCO
$IncludeConfig /etc/rsyslog.d/*.conf
$RepeatedMsgReduction off
$RepeatedMsgContainsOriginalMsg on
$LocalHostName HOST-LOCO
$MainMsgQueueWorkerThreads 100
$EscapeControlCharactersOnReceive off
$FileOwner root
$FileGroup adm
$FileCreateMode 0640
$DirCreateMode 0755
$Umask 0027
$CreateDirs off
$DirCreateMode 0750
$MaxMessageSize 4k
$ActionFileDefaultTemplate RSYSLOG_TraditionalFileFormat
auth,authpriv.*                 -/var/log/auth.log
*.*;auth,authpriv.none          -/var/log/syslog
daemon.*                        -/var/log/daemon.log
kern.*                          -/var/log/kern.log
lpr.*                           -/var/log/lpr.log
mail.*                          -/var/log/mail.log
user.*                          -/var/log/user.log
mail.info                       -/var/log/mail.info
mail.warn                       -/var/log/mail.warn
mail.err                        -/var/log/mail.err
news.crit                       -/var/log/news/news.crit
news.err                        -/var/log/news/news.err
news.notice                     -/var/log/news/news.notice
*.=debug;\
        auth,authpriv.none;\
        news.none;mail.none     -/var/log/debug
*.=info;*.=notice;*.=warn;\
        auth,authpriv.none;\
        cron,daemon.none;\
        kern,mail,news.none     -/var/log/messages
$WorkDirectory /var/log
```
rsyslog.d/*.conf
```
~# awk '!/^#|^\s+#|^$/' /etc/rsyslog.d/*.conf
input(type="imuxsock"
      Socket="/chroot/local/dev/log"
      CreatePath="on")
module(load="imtcp")
input(type="imtcp" port="15514")
$AddUnixListenSocket /var/spool/postfix/dev/log
$ModLoad impstats
$PStatInterval 600
$PStatSeverity 7
syslog.=debug -/var/log/rsyslog.stats
& stop
```
OS information
```
~# uname -a
Linux HOST-LOCO 4.19.0-5-amd64 #1 SMP Debian 4.19.37-3 (2019-05-15) x86_64 GNU/Linux
~# cat /etc/debian_version
10.0
~# dpkg -l rsyslog
Desired=Unknown/Install/Remove/Purge/Hold
| Status=Not/Inst/Conf-files/Unpacked/halF-conf/Half-inst/trig-aWait/Trig-pend
|/ Err?=(none)/Reinst-required (Status,Err: uppercase=bad)
||/ Name           Version      Architecture Description
+++-==============-============-============-=========================================
ii  rsyslog        8.1901.0-1   amd64        reliable system and kernel logging daemon
~# dpkg -L rsyslog|grep tcp
/usr/lib/x86_64-linux-gnu/rsyslog/imptcp.so
/usr/lib/x86_64-linux-gnu/rsyslog/imtcp.so
/usr/lib/x86_64-linux-gnu/rsyslog/lmnsd_ptcp.so
/usr/lib/x86_64-linux-gnu/rsyslog/lmtcpclt.so
/usr/lib/x86_64-linux-gnu/rsyslog/lmtcpsrv.so
~# find /usr \( -name imtcp.so -or -name imptcp.so \) -exec ls -la {} \;
-rw-r--r-- 1 root root 28352 Feb 26 18:43 /usr/lib/x86_64-linux-gnu/rsyslog/imtcp.so
-rw-r--r-- 1 root root 49072 Feb 26 18:43 /usr/lib/x86_64-linux-gnu/rsyslog/imptcp.so
```

**Comment by skupkosk** [comment]
Not able to test latest 8.1905 version from OBS repo as it is not built with the imptcp module.

```
~# dpkg -l rsyslog
Desired=Unknown/Install/Remove/Purge/Hold
| Status=Not/Inst/Conf-files/Unpacked/halF-conf/Half-inst/trig-aWait/Trig-pend
|/ Err?=(none)/Reinst-required (Status,Err: uppercase=bad)
||/ Name           Version      Architecture Description
+++-==============-============-============-=======================================
ii  rsyslog        8.1905.0-1   amd64        a rocket-fast system for log processing
~# rsyslogd -v
rsyslogd  8.1905.0 (aka 2019.05) compiled with:
        PLATFORM:                               x86_64-pc-linux-gnu
        PLATFORM (lsb_release -d):
        FEATURE_REGEXP:                         Yes
        GSSAPI Kerberos 5 support:              No
        FEATURE_DEBUG (debug build, slow code): No
        32bit Atomic operations supported:      Yes
        64bit Atomic operations supported:      Yes
        memory allocator:                       system default
        Runtime Instrumentation (slow code):    No
        uuid support:                           Yes
        systemd support:                        Yes
        Config file:                            /etc/rsyslog.conf
        PID file:                               /var/run/rsyslogd.pid
        Number of Bits in RainerScript integers: 64

See https://www.rsyslog.com for more information.
~# dpkg -L rsyslog|grep tcp
/usr/lib/rsyslog/imtcp.so
/usr/lib/rsyslog/lmnsd_ptcp.so
/usr/lib/rsyslog/lmtcpclt.so
/usr/lib/rsyslog/lmtcpsrv.so
```

**Comment by skupkosk** [comment]
It is obvious the imtcp provides different output than imptcp from attached debug logs - at least it use dnscache, while imptcp does not...

Some internal 'hooks' missing for imptcp module maybe?

[rsyslog-imptcp.log](https://github.com/rsyslog/rsyslog/files/3345958/rsyslog-imptcp.log)
[rsyslog-imtcp.log](https://github.com/rsyslog/rsyslog/files/3345959/rsyslog-imtcp.log)

**Comment by skupkosk** [comment]
Just discovered it is caused by the logger version used for testing.
Logger 2.25.2 is causing the message not written to files, but sending messages with logger 2.33.1 is fine.
Also sending messages with use of telnet is fine.

**Comment by davidelang** [comment]
what is different between the two versions when looking at it over the wire 
(tcpdump s0 -X will give good data)

David Lang

**Comment by skupkosk** [comment]
The old logger send old 3164 formatted message without hostname and finish the line with '00', but new logger send 5424 format with '0a' on the end.

**new logger**
```
09:20:49.613448 IP 10.0.1.2.42700 > 10.0.1.3.15514: Flags [P.], seq 1:180, ack 1, win 229, options [nop,nop,TS val 319060832 ecr 1767050000], length 179
        0x0000:  4500 00e7 09f4 4000 4006 493b 0a01 e970  E.....@.@.I;...p
        0x0010:  0a01 e96f a6cc 3c9a 2bf5 3fcd 0df9 de9f  ...o..<.+.?.....
        0x0020:  8018 00e5 0755 0000 0101 080a 1304 7b60  .....U........{`
        0x0030:  6953 0b10 3c31 343e 3120 3230 3139 2d30  iS..<14>1.2019-0
        0x0040:  372d 3032 5430 393a 3230 3a34 392e 3632  7-02T09:20:49.62
        0x0050:  3030 3037 2b30 323a 3030 2048 4f53 542d  0007+02:00.HOST-
        0x0060:  4c4f 434f 3320 7465 7374 696d 7074 6370  LOCO3.testimptcp
        0x0070:  2031 3739 3331 202d 205b 7469 6d65 5175  .17931.-.[timeQu
        0x0080:  616c 6974 7920 747a 4b6e 6f77 6e3d 2231  ality.tzKnown="1
        0x0090:  2220 6973 5379 6e63 6564 3d22 3122 2073  ".isSynced="1".s
        0x00a0:  796e 6341 6363 7572 6163 793d 2236 3139  yncAccuracy="619
        0x00b0:  3032 3722 5d20 7465 7374 696e 6720 6d65  027"].testing.me
...
        0x00e0:  3035 3230 3439 0a                        052049.
```
**old logger**
```
09:21:53.973161 IP 10.0.1.2.56581 > 10.0.1.2.15514: Flags [P.], seq 1:89, ack 1, win 229, options [nop,nop,TS val 2412510087 ecr 2338610658], length 88
        0x0000:  4500 008c 6594 4000 4006 ee5e 0a01 e907  E...e.@.@..^....
        0x0010:  0a01 e96f dd05 3c9a d804 9e16 e45e 1c6a  ...o..<......^.j
        0x0020:  8018 00e5 c4fc 0000 0101 080a 8fcb fb87  ................
        0x0030:  8b64 5de2 3c31 343e 4a75 6c20 2032 2030  .d].<14>Jul..2.0
        0x0040:  393a 3231 3a35 3320 7465 7374 696d 7074  9:21:53.testimpt
        0x0050:  6370 5b32 3639 3636 5d3a 2074 6573 7469  cp[26966]:.testi
        0x0060:  6e67 206d 6573 7361 6765 2074 6f20 3130  ng.message.to.10
...
        0x0080:  2031 3536 3230 3532 3131 3300            .1562052113.
```

The same message sent with tcpdump is finished by '0a' and written to file (hostname is supplemented by rsyslog).
The same is handled ok with imtcp module in both cases and all messages are processed by omfile actions.

**Comment by rgerhards** [comment]
Apologies for the very late reply. This is probably no longer relevant for the original report, but I am adding the resolution here for people who arrive via search while we work through the older backlog. We do not close old issues lightly or just because of age.

The later comments identify the key difference: the failing test used an older `logger` that sent an old RFC3164-style payload without a hostname and terminated the TCP payload with `0x00`, while the working test used a newer `logger` that terminated the message with `0x0a` (newline). `imptcp` did accept and read the bytes, but with that wire format it did not see a normal line-delimited syslog message to process. The same test also worked when sent with a normal newline terminator.

So this appears to be a sender/framing issue rather than an rsyslog listener bug. For TCP syslog, use a sender that emits a proper delimiter such as LF, or use an unambiguous framing mode such as octet-counted framing where available. I am closing this as answered. If this still reproduces with a current rsyslog version and a correctly framed TCP syslog message, please open a new issue with the exact packet capture and minimal rsyslog config.
