### ISSUE TITLE
CLOSE_WAIT socket stays in for a long time

### ISSUE THREAD

**Issue by khfayzullaev** [rsyslog/rsyslog#4257]
## Context

I had two EC2 instances. The first instance was running Rsyslog. Another one was running Logstash with the [TCP input plugin](https://www.elastic.co/guide/en/logstash/current/plugins-inputs-tcp.html#plugins-inputs-tcp).

IP addresses in the logs to follow:
- Rsyslog: `10.16.5.108`
- Logstash: `10.16.4.122`

Everything worked fine until I terminated the Logstash EC2 instance. I was able to confirm that the _FIN_ signal was received on the Rsyslog side. Here is an output from _tcpdump_ (time in UTC):

```
...
02:26:51.071397 IP ip-10-16-5-108.ec2.internal.40814 > ip-10-16-4-122.ec2.internal.10516: Flags [P.], seq 53152637:53153023, ack 1938878129, win 491, options [nop,nop,TS val 3771812060 ecr 428610140], length 386
02:26:51.071570 IP ip-10-16-4-122.ec2.internal.10516 > ip-10-16-5-108.ec2.internal.40814: Flags [.], ack 386, win 442, options [nop,nop,TS val 428614157 ecr 3771812060], length 0
02:27:00.262241 IP ip-10-16-5-108.ec2.internal.40814 > ip-10-16-4-122.ec2.internal.10516: Flags [P.], seq 386:703, ack 1, win 491, options [nop,nop,TS val 3771821251 ecr 428614157], length 317
02:27:00.262415 IP ip-10-16-4-122.ec2.internal.10516 > ip-10-16-5-108.ec2.internal.40814: Flags [.], ack 703, win 442, options [nop,nop,TS val 428623348 ecr 3771821251], length 0
02:27:00.262943 IP ip-10-16-5-108.ec2.internal.40814 > ip-10-16-4-122.ec2.internal.10516: Flags [P.], seq 703:938, ack 1, win 491, options [nop,nop,TS val 3771821252 ecr 428623348], length 235
02:27:00.263091 IP ip-10-16-4-122.ec2.internal.10516 > ip-10-16-5-108.ec2.internal.40814: Flags [.], ack 938, win 442, options [nop,nop,TS val 428623349 ecr 3771821252], length 0
02:27:01.071985 IP ip-10-16-5-108.ec2.internal.40814 > ip-10-16-4-122.ec2.internal.10516: Flags [P.], seq 938:1324, ack 1, win 491, options [nop,nop,TS val 3771822061 ecr 428623349], length 386
02:27:01.072153 IP ip-10-16-4-122.ec2.internal.10516 > ip-10-16-5-108.ec2.internal.40814: Flags [.], ack 1324, win 442, options [nop,nop,TS val 428624158 ecr 3771822061], length 0
02:27:06.980690 IP ip-10-16-5-108.ec2.internal.40814 > ip-10-16-4-122.ec2.internal.10516: Flags [P.], seq 1324:1506, ack 1, win 491, options [nop,nop,TS val 3771827970 ecr 428624158], length 182
02:27:06.980864 IP ip-10-16-4-122.ec2.internal.10516 > ip-10-16-5-108.ec2.internal.40814: Flags [.], ack 1506, win 442, options [nop,nop,TS val 428630067 ecr 3771827970], length 0
02:27:11.071933 IP ip-10-16-5-108.ec2.internal.40814 > ip-10-16-4-122.ec2.internal.10516: Flags [P.], seq 1506:1892, ack 1, win 491, options [nop,nop,TS val 3771832061 ecr 428630067], length 386
02:27:11.072112 IP ip-10-16-4-122.ec2.internal.10516 > ip-10-16-5-108.ec2.internal.40814: Flags [.], ack 1892, win 442, options [nop,nop,TS val 428634158 ecr 3771832061], length 0
02:27:21.073672 IP ip-10-16-5-108.ec2.internal.40814 > ip-10-16-4-122.ec2.internal.10516: Flags [P.], seq 1892:2278, ack 1, win 491, options [nop,nop,TS val 3771842063 ecr 428634158], length 386
02:27:21.073843 IP ip-10-16-4-122.ec2.internal.10516 > ip-10-16-5-108.ec2.internal.40814: Flags [.], ack 2278, win 442, options [nop,nop,TS val 428644160 ecr 3771842063], length 0
02:27:23.628709 IP ip-10-16-4-122.ec2.internal.10516 > ip-10-16-5-108.ec2.internal.40814: Flags [F.], seq 1, ack 2278, win 442, options [nop,nop,TS val 428646715 ecr 3771842063], length 0
02:27:23.630663 IP ip-10-16-5-108.ec2.internal.40814 > ip-10-16-4-122.ec2.internal.10516: Flags [.], ack 2, win 491, options [nop,nop,TS val 3771844620 ecr 428646715], length 0
02:27:31.072966 IP ip-10-16-5-108.ec2.internal.40814 > ip-10-16-4-122.ec2.internal.10516: Flags [P.], seq 2278:2664, ack 2, win 491, options [nop,nop,TS val 3771852062 ecr 428646715], length 386
02:27:31.278753 IP ip-10-16-5-108.ec2.internal.40814 > ip-10-16-4-122.ec2.internal.10516: Flags [P.], seq 2278:2664, ack 2, win 491, options [nop,nop,TS val 3771852268 ecr 428646715], length 386
02:27:31.486686 IP ip-10-16-5-108.ec2.internal.40814 > ip-10-16-4-122.ec2.internal.10516: Flags [P.], seq 2278:2664, ack 2, win 491, options [nop,nop,TS val 3771852476 ecr 428646715], length 386
02:27:31.898701 IP ip-10-16-5-108.ec2.internal.40814 > ip-10-16-4-122.ec2.internal.10516: Flags [P.], seq 2278:2664, ack 2, win 491, options [nop,nop,TS val 3771852888 ecr 428646715], length 386
02:27:32.730700 IP ip-10-16-5-108.ec2.internal.40814 > ip-10-16-4-122.ec2.internal.10516: Flags [P.], seq 2278:2664, ack 2, win 491, options [nop,nop,TS val 3771853720 ecr 428646715], length 386
02:27:34.394703 IP ip-10-16-5-108.ec2.internal.40814 > ip-10-16-4-122.ec2.internal.10516: Flags [P.], seq 2278:2664, ack 2, win 491, options [nop,nop,TS val 3771855384 ecr 428646715], length 386
02:27:37.850681 IP ip-10-16-5-108.ec2.internal.40814 > ip-10-16-4-122.ec2.internal.10516: Flags [P.], seq 2278:2664, ack 2, win 491, options [nop,nop,TS val 3771858840 ecr 428646715], length 386
02:27:44.506703 IP ip-10-16-5-108.ec2.internal.40814 > ip-10-16-4-122.ec2.internal.10516: Flags [P.], seq 2278:2664, ack 2, win 491, options [nop,nop,TS val 3771865496 ecr 428646715], length 386
02:27:57.818701 IP ip-10-16-5-108.ec2.internal.40814 > ip-10-16-4-122.ec2.internal.10516: Flags [P.], seq 2278:2664, ack 2, win 491, options [nop,nop,TS val 3771878808 ecr 428646715], length 386
```

Notice the following line:

```
02:27:23.628709 IP ip-10-16-4-122.ec2.internal.10516 > ip-10-16-5-108.ec2.internal.40814: Flags [F.], seq 1, ack 2278, win 442, options [nop,nop,TS val 428646715 ecr 3771842063], length 0
```

Right at that time, the connection changed the sate to _CLOSE_WAIT_.

## Expected behavior

I expected Rsyslog to stop sending messages and execute _close()_ on the socket.

## Actual behavior

However, the connection was stuck in _CLOSE_WAIT_ indefinitely. I noticed that the send queue (Send-Q) for this socket continued to grow as Rsyslog kept pushing messages further. Form _tcpdump_, you can notice that actual package transfer stopped at 02:27:57.

## strace

Here is an output from _strace'ing_ Rsyslog during that period (time is in POSIX time):
```
...
26292 1587782576.241273 recvfrom(27, "", 1, MSG_PEEK|MSG_DONTWAIT, NULL, NULL) = 0 <0.000010>
26292 1587782576.241325 sendto(27, "{\"program\":\"sshd\", \"host\":\"khurs"..., 232, 0, NULL, 0) = 232 <0.000012>
26292 1587782576.241542 recvfrom(27, "", 1, MSG_PEEK|MSG_DONTWAIT, NULL, NULL) = 0 <0.000007>
26292 1587782576.241576 sendto(27, "{\"program\":\"sshd\", \"host\":\"khurs"..., 214, 0, NULL, 0) = 214 <0.000008>
26285 1587782576.241687 recvmsg(6, {msg_name=NULL, msg_namelen=0, msg_iov=[{iov_base="<86>Apr 25 02:42:56 ss"..., iov_len=65536}], msg_iovlen=1, msg_control=[{cmsg_len=32, cmsg_level=SOL_SOCKET, cmsg_type=SCM_TIMESTAMP, cmsg_data={tv_sec=1587782576, tv_usec=240918}}, {cmsg_len=28, cmsg_level=SOL_SOCKET, cmsg_type=SCM_CREDENTIALS, cmsg_data={pid=5868, uid=0, gid=0}}], msg_controllen=64, msg_flags=0}, MSG_DONTWAIT) = 88 <0.000009>
26292 1587782576.241886 recvfrom(27, "", 1, MSG_PEEK|MSG_DONTWAIT, NULL, NULL) = 0 <0.000008>
26292 1587782576.241923 sendto(27, "{\"program\":\"sshd\", \"host\":\"khurs"..., 220, 0, NULL, 0) = 220 <0.000009>
26285 1587782576.247734 recvmsg(3, {msg_name=NULL, msg_namelen=0, msg_iov=[{iov_base="<38>Apr 25 02:42:56 systemd-logi"..., iov_len=65536}], msg_iovlen=1, msg_control=[{cmsg_len=32, cmsg_level=SOL_SOCKET, cmsg_type=SCM_TIMESTAMP, cmsg_data={tv_sec=1587782576, tv_usec=247409}}, {cmsg_len=28, cmsg_level=SOL_SOCKET, cmsg_type=SCM_CREDENTIALS, cmsg_data={pid=1175, uid=0, gid=0}}], msg_controllen=64, msg_flags=0}, MSG_DONTWAIT) = 61 <0.000010>
26292 1587782576.247929 recvfrom(27, "", 1, MSG_PEEK|MSG_DONTWAIT, NULL, NULL) = 0 <0.000024>
26292 1587782576.247980 sendto(27, "{\"program\":\"systemd-logind\", \"ho"..., 188, 0, NULL, 0) = 188 <0.000008>
26285 1587782581.068835 recvmsg(3, {msg_name=NULL, msg_namelen=0, msg_iov=[{iov_base="<30>Apr 25 02:43:01 signalfx-age"..., iov_len=65536}], msg_iovlen=1, msg_control=[{cmsg_len=32, cmsg_level=SOL_SOCKET, cmsg_type=SCM_TIMESTAMP, cmsg_data={tv_sec=1587782581, tv_usec=68382}}, {cmsg_len=28, cmsg_level=SOL_SOCKET, cmsg_type=SCM_CREDENTIALS, cmsg_data={pid=1221, uid=998, gid=998}}], msg_controllen=64, msg_flags=0}, MSG_DONTWAIT) = 248 <0.000042>
26292 1587782581.069199 recvfrom(27, "", 1, MSG_PEEK|MSG_DONTWAIT, NULL, NULL) = 0 <0.000011>
26292 1587782581.070103 sendto(27, "{\"program\":\"signalfx-agent\", \"ho"..., 386, 0, NULL, 0) = 386 <0.000023>
26285 1587782587.359447 recvmsg(6, {msg_name=NULL, msg_namelen=0, msg_iov=[{iov_base="<85>Apr 25 02:43:07 ss"..., iov_len=65536}], msg_iovlen=1, msg_control=[{cmsg_len=32, cmsg_level=SOL_SOCKET, cmsg_type=SCM_TIMESTAMP, cmsg_data={tv_sec=1587782587, tv_usec=358869}}, {cmsg_len=28, cmsg_level=SOL_SOCKET, cmsg_type=SCM_CREDENTIALS, cmsg_data={pid=6065, uid=0, gid=0}}], msg_controllen=64, msg_flags=0}, MSG_DONTWAIT) = 147 <0.000024>
26292 1587782587.360787 recvfrom(27, "", 1, MSG_PEEK|MSG_DONTWAIT, NULL, NULL) = 0 <0.000014>
26292 1587782587.360857 sendto(27, "{\"program\":\"sshd\", \"host\":\"khurs"..., 281, 0, NULL, 0) = -1 EHOSTUNREACH (No route to host) <0.000007>
26270 1587782587.360953 --- SIGTTOU {si_signo=SIGTTOU, si_code=SI_USER, si_pid=26270, si_uid=102} ---
26270 1587782587.361140 sendto(13, "<43>Apr 25 02:43:07 rsyslogd: om"..., 153, MSG_NOSIGNAL, NULL, 0) = 153 <0.000029>
26285 1587782587.361242 recvmsg(6, {msg_name=NULL, msg_namelen=0, msg_iov=[{iov_base="<43>Apr 25 02:43:07 rsyslogd: om"..., iov_len=65536}], msg_iovlen=1, msg_control=[{cmsg_len=32, cmsg_level=SOL_SOCKET, cmsg_type=SCM_TIMESTAMP, cmsg_data={tv_sec=1587782587, tv_usec=361175}}, {cmsg_len=28, cmsg_level=SOL_SOCKET, cmsg_type=SCM_CREDENTIALS, cmsg_data={pid=26270, uid=102, gid=106}}], msg_controllen=64, msg_flags=0}, MSG_DONTWAIT) = 153 <0.000028>
26270 1587782587.361390 --- SIGTTOU {si_signo=SIGTTOU, si_code=SI_USER, si_pid=26270, si_uid=102} ---
26270 1587782587.361495 sendto(13, "<44>Apr 25 02:43:07 rsyslogd: ac"..., 229, MSG_NOSIGNAL, NULL, 0) = 229 <0.000033>
26285 1587782587.361613 recvmsg(6, {msg_name=NULL, msg_namelen=0, msg_iov=[{iov_base="<44>Apr 25 02:43:07 rsyslogd: ac"..., iov_len=65536}], msg_iovlen=1, msg_control=[{cmsg_len=32, cmsg_level=SOL_SOCKET, cmsg_type=SCM_TIMESTAMP, cmsg_data={tv_sec=1587782587, tv_usec=361532}}, {cmsg_len=28, cmsg_level=SOL_SOCKET, cmsg_type=SCM_CREDENTIALS, cmsg_data={pid=26270, uid=102, gid=106}}], msg_controllen=64, msg_flags=0}, MSG_DONTWAIT) = 229 <0.000044>
26292 1587782587.361963 socket(AF_INET, SOCK_STREAM, IPPROTO_TCP) = 27 <0.000026>
26292 1587782587.362020 connect(27, {sa_family=AF_INET, sin_port=htons(10516), sin_addr=inet_addr("10.16.4.122")}, 16 <unfinished ...>
26285 1587782589.499902 recvmsg(6, {msg_name=NULL, msg_namelen=0, msg_iov=[{iov_base="<27>Apr 25 02:43:09 [ss"..., iov_len=65536}], msg_iovlen=1, msg_control=[{cmsg_len=32, cmsg_level=SOL_SOCKET, cmsg_type=SCM_TIMESTAMP, cmsg_data={tv_sec=1587782589, tv_usec=498956}}, {cmsg_len=28, cmsg_level=SOL_SOCKET, cmsg_type=SCM_CREDENTIALS, cmsg_data={pid=6100, uid=238001393, gid=238000513}}], msg_controllen=64, msg_flags=0}, MSG_DONTWAIT) = 70 <0.000028>
26285 1587782589.500077 recvmsg(6, {msg_name=NULL, msg_namelen=0, msg_iov=[{iov_base="<27>Apr 25 02:43:09 [ss"..., iov_len=65536}], msg_iovlen=1, msg_control=[{cmsg_len=32, cmsg_level=SOL_SOCKET, cmsg_type=SCM_TIMESTAMP, cmsg_data={tv_sec=1587782589, tv_usec=499011}}, {cmsg_len=28, cmsg_level=SOL_SOCKET, cmsg_type=SCM_CREDENTIALS, cmsg_data={pid=6100, uid=238001393, gid=238000513}}], msg_controllen=64, msg_flags=0}, MSG_DONTWAIT) = 70 <0.000052>
26285 1587782589.500255 recvmsg(6, {msg_name=NULL, msg_namelen=0, msg_iov=[{iov_base="<27>Apr 25 02:43:09 [ss"..., iov_len=65536}], msg_iovlen=1, msg_control=[{cmsg_len=32, cmsg_level=SOL_SOCKET, cmsg_type=SCM_TIMESTAMP, cmsg_data={tv_sec=1587782589, tv_usec=499028}}, {cmsg_len=28, cmsg_level=SOL_SOCKET, cmsg_type=SCM_CREDENTIALS, cmsg_data={pid=6100, uid=238001393, gid=238000513}}], msg_controllen=64, msg_flags=0}, MSG_DONTWAIT) = 70 <0.000035>
26285 1587782589.500542 recvmsg(6, {msg_name=NULL, msg_namelen=0, msg_iov=[{iov_base="<85>Apr 25 02:43:09 ss: "..., iov_len=65536}], msg_iovlen=1, msg_control=[{cmsg_len=32, cmsg_level=SOL_SOCKET, cmsg_type=SCM_TIMESTAMP, cmsg_data={tv_sec=1587782589, tv_usec=499800}}, {cmsg_len=28, cmsg_level=SOL_SOCKET, cmsg_type=SCM_CREDENTIALS, cmsg_data={pid=6065, uid=0, gid=0}}], msg_controllen=64, msg_flags=0}, MSG_DONTWAIT) = 145 <0.000023>
26285 1587782589.500812 recvmsg(6, {msg_name=NULL, msg_namelen=0, msg_iov=[{iov_base="<85>Apr 25 02:43:09 ss"..., iov_len=65536}], msg_iovlen=1, msg_control=[{cmsg_len=32, cmsg_level=SOL_SOCKET, cmsg_type=SCM_TIMESTAMP, cmsg_data={tv_sec=1587782589, tv_usec=499818}}, {cmsg_len=28, cmsg_level=SOL_SOCKET, cmsg_type=SCM_CREDENTIALS, cmsg_data={pid=6065, uid=0, gid=0}}], msg_controllen=64, msg_flags=0}, MSG_DONTWAIT) = 117 <0.000021>
26292 1587782590.426915 <... connect resumed> ) = -1 EHOSTUNREACH (No route to host) <3.064870>
26270 1587782590.427030 --- SIGTTOU {si_signo=SIGTTOU, si_code=SI_USER, si_pid=26270, si_uid=102} ---
26270 1587782590.427176 sendto(13, "<43>Apr 25 02:43:10 rsyslogd: ca"..., 131, MSG_NOSIGNAL, NULL, 0) = 131 <0.000047>
26285 1587782590.427285 recvmsg(6, {msg_name=NULL, msg_namelen=0, msg_iov=[{iov_base="<43>Apr 25 02:43:10 rsyslogd: ca"..., iov_len=65536}], msg_iovlen=1, msg_control=[{cmsg_len=32, cmsg_level=SOL_SOCKET, cmsg_type=SCM_TIMESTAMP, cmsg_data={tv_sec=1587782590, tv_usec=427219}}, {cmsg_len=28, cmsg_level=SOL_SOCKET, cmsg_type=SCM_CREDENTIALS, cmsg_data={pid=26270, uid=102, gid=106}}], msg_controllen=64, msg_flags=0}, MSG_DONTWAIT) = 131 <0.000022>
26285 1587782591.071723 recvmsg(3, {msg_name=NULL, msg_namelen=0, msg_iov=[{iov_base="<30>Apr 25 02:43:11 signalfx-age"..., iov_len=65536}], msg_iovlen=1, msg_control=[{cmsg_len=32, cmsg_level=SOL_SOCKET, cmsg_type=SCM_TIMESTAMP, cmsg_data={tv_sec=1587782591, tv_usec=71537}}, {cmsg_len=28, cmsg_level=SOL_SOCKET, cmsg_type=SCM_CREDENTIALS, cmsg_data={pid=1221, uid=998, gid=998}}], msg_controllen=64, msg_flags=0}, MSG_DONTWAIT) = 248 <0.000015>
26285 1587782591.140733 recvmsg(6, {msg_name=NULL, msg_namelen=0, msg_iov=[{iov_base="<38>Apr 25 02:43:11 ss"..., iov_len=65536}], msg_iovlen=1, msg_control=[{cmsg_len=32, cmsg_level=SOL_SOCKET, cmsg_type=SCM_TIMESTAMP, cmsg_data={tv_sec=1587782591, tv_usec=140561}}, {cmsg_len=28, cmsg_level=SOL_SOCKET, cmsg_type=SCM_CREDENTIALS, cmsg_data={pid=6065, uid=0, gid=0}}], msg_controllen=64, msg_flags=0}, MSG_DONTWAIT) = 94 <0.000017>
26285 1587782596.745815 recvmsg(6, {msg_name=NULL, msg_namelen=0, msg_iov=[{iov_base="<86>Apr 25 02:43:16 ss"..., iov_len=65536}], msg_iovlen=1, msg_control=[{cmsg_len=32, cmsg_level=SOL_SOCKET, cmsg_type=SCM_TIMESTAMP, cmsg_data={tv_sec=1587782596, tv_usec=745738}}, {cmsg_len=28, cmsg_level=SOL_SOCKET, cmsg_type=SCM_CREDENTIALS, cmsg_data={pid=6065, uid=0, gid=0}}], msg_controllen=64, msg_flags=0}, MSG_DONTWAIT) = 145 <0.000013>
26285 1587782597.193992 recvmsg(6, {msg_name=NULL, msg_namelen=0, msg_iov=[{iov_base="<38>Apr 25 02:43:17 ss"..., iov_len=65536}], msg_iovlen=1, msg_control=[{cmsg_len=32, cmsg_level=SOL_SOCKET, cmsg_type=SCM_TIMESTAMP, cmsg_data={tv_sec=1587782597, tv_usec=193883}}, {cmsg_len=28, cmsg_level=SOL_SOCKET, cmsg_type=SCM_CREDENTIALS, cmsg_data={pid=6065, uid=0, gid=0}}], msg_controllen=64, msg_flags=0}, MSG_DONTWAIT) = 96 <0.000028>
26285 1587782597.199395 recvmsg(6, {msg_name=NULL, msg_namelen=0, msg_iov=[{iov_base="<86>Apr 25 02:43:17 ss"..., iov_len=65536}], msg_iovlen=1, msg_control=[{cmsg_len=32, cmsg_level=SOL_SOCKET, cmsg_type=SCM_TIMESTAMP, cmsg_data={tv_sec=1587782597, tv_usec=199217}}, {cmsg_len=28, cmsg_level=SOL_SOCKET, cmsg_type=SCM_CREDENTIALS, cmsg_data={pid=6065, uid=0, gid=0}}], msg_controllen=64, msg_flags=0}, MSG_DONTWAIT) = 99 <0.000736>
26285 1587782597.203996 recvmsg(3, {msg_name=NULL, msg_namelen=0, msg_iov=[{iov_base="<38>Apr 25 02:43:17 systemd-logi"..., iov_len=65536}], msg_iovlen=1, msg_control=[{cmsg_len=32, cmsg_level=SOL_SOCKET, cmsg_type=SCM_TIMESTAMP, cmsg_data={tv_sec=1587782597, tv_usec=203704}}, {cmsg_len=28, cmsg_level=SOL_SOCKET, cmsg_type=SCM_CREDENTIALS, cmsg_data={pid=1175, uid=0, gid=0}}], msg_controllen=64, msg_flags=0}, MSG_DONTWAIT) = 74 <0.000015>
26285 1587782597.204136 recvmsg(3, {msg_name=NULL, msg_namelen=0, msg_iov=[{iov_base="<30>Apr 25 02:43:17 systemd[1]: "..., iov_len=65536}], msg_iovlen=1, msg_control=[{cmsg_len=32, cmsg_level=SOL_SOCKET, cmsg_type=SCM_TIMESTAMP, cmsg_data={tv_sec=1587782597, tv_usec=204080}}, {cmsg_len=28, cmsg_level=SOL_SOCKET, cmsg_type=SCM_CREDENTIALS, cmsg_data={pid=1, uid=0, gid=0}}], msg_controllen=64, msg_flags=0}, MSG_DONTWAIT) = 68 <0.000012>
26285 1587782597.981014 recvmsg(6, {msg_name=NULL, msg_namelen=0, msg_iov=[{iov_base="<38>Apr 25 02:43:17 ss: "..., iov_len=65536}], msg_iovlen=1, msg_control=[{cmsg_len=32, cmsg_level=SOL_SOCKET, cmsg_type=SCM_TIMESTAMP, cmsg_data={tv_sec=1587782597, tv_usec=980913}}, {cmsg_len=28, cmsg_level=SOL_SOCKET, cmsg_type=SCM_CREDENTIALS, cmsg_data={pid=6259, uid=238001393, gid=238000513}}], msg_controllen=64, msg_flags=0}, MSG_DONTWAIT) = 105 <0.000030>
26285 1587782597.981465 recvmsg(6, {msg_name=NULL, msg_namelen=0, msg_iov=[{iov_base="<38>Apr 25 02:43:17 ss: "..., iov_len=65536}], msg_iovlen=1, msg_control=[{cmsg_len=32, cmsg_level=SOL_SOCKET, cmsg_type=SCM_TIMESTAMP, cmsg_data={tv_sec=1587782597, tv_usec=981077}}, {cmsg_len=28, cmsg_level=SOL_SOCKET, cmsg_type=SCM_CREDENTIALS, cmsg_data={pid=6259, uid=238001393, gid=238000513}}], msg_controllen=64, msg_flags=0}, MSG_DONTWAIT) = 87 <0.000030>
26285 1587782597.982056 recvmsg(6, {msg_name=NULL, msg_namelen=0, msg_iov=[{iov_base="<86>Apr 25 02:43:17 ss: "..., iov_len=65536}], msg_iovlen=1, msg_control=[{cmsg_len=32, cmsg_level=SOL_SOCKET, cmsg_type=SCM_TIMESTAMP, cmsg_data={tv_sec=1587782597, tv_usec=982011}}, {cmsg_len=28, cmsg_level=SOL_SOCKET, cmsg_type=SCM_CREDENTIALS, cmsg_data={pid=6065, uid=0, gid=0}}], msg_controllen=64, msg_flags=0}, MSG_DONTWAIT) = 88 <0.000021>
26285 1587782597.986538 recvmsg(6, {msg_name=NULL, msg_namelen=0, msg_iov=[{iov_base="<85>Apr 25 02:43:17 ss"..., iov_len=65536}], msg_iovlen=1, msg_control=[{cmsg_len=32, cmsg_level=SOL_SOCKET, cmsg_type=SCM_TIMESTAMP, cmsg_data={tv_sec=1587782597, tv_usec=986473}}, {cmsg_len=28, cmsg_level=SOL_SOCKET, cmsg_type=SCM_CREDENTIALS, cmsg_data={pid=6065, uid=0, gid=0}}], msg_controllen=64, msg_flags=0}, MSG_DONTWAIT) = 137 <0.000023>
26285 1587782597.989836 recvmsg(3, {msg_name=NULL, msg_namelen=0, msg_iov=[{iov_base="<38>Apr 25 02:43:17 systemd-logi"..., iov_len=65536}], msg_iovlen=1, msg_control=[{cmsg_len=32, cmsg_level=SOL_SOCKET, cmsg_type=SCM_TIMESTAMP, cmsg_data={tv_sec=1587782597, tv_usec=989450}}, {cmsg_len=28, cmsg_level=SOL_SOCKET, cmsg_type=SCM_CREDENTIALS, cmsg_data={pid=1175, uid=0, gid=0}}], msg_controllen=64, msg_flags=0}, MSG_DONTWAIT) = 61 <0.000012>
26292 1587782600.435263 socket(AF_INET, SOCK_STREAM, IPPROTO_TCP) = 27 <0.000033>
26292 1587782600.435344 connect(27, {sa_family=AF_INET, sin_port=htons(10516), sin_addr=inet_addr("10.16.4.122")}, 16 <unfinished ...>
26285 1587782601.068211 recvmsg(3, {msg_name=NULL, msg_namelen=0, msg_iov=[{iov_base="<30>Apr 25 02:43:21 signalfx-age"..., iov_len=65536}], msg_iovlen=1, msg_control=[{cmsg_len=32, cmsg_level=SOL_SOCKET, cmsg_type=SCM_TIMESTAMP, cmsg_data={tv_sec=1587782601, tv_usec=67934}}, {cmsg_len=28, cmsg_level=SOL_SOCKET, cmsg_type=SCM_CREDENTIALS, cmsg_data={pid=1221, uid=998, gid=998}}], msg_controllen=64, msg_flags=0}, MSG_DONTWAIT) = 248 <0.000015>
26292 1587782603.514853 <... connect resumed> ) = -1 EHOSTUNREACH (No route to host) <3.079483>
26270 1587782603.514963 --- SIGTTOU {si_signo=SIGTTOU, si_code=SI_USER, si_pid=26270, si_uid=102} ---
26270 1587782603.515106 sendto(13, "<43>Apr 25 02:43:23 rsyslogd: ca"..., 131, MSG_NOSIGNAL, NULL, 0) = 131 <0.000042>
26285 1587782603.515215 recvmsg(6, {msg_name=NULL, msg_namelen=0, msg_iov=[{iov_base="<43>Apr 25 02:43:23 rsyslogd: ca"..., iov_len=65536}], msg_iovlen=1, msg_control=[{cmsg_len=32, cmsg_level=SOL_SOCKET, cmsg_type=SCM_TIMESTAMP, cmsg_data={tv_sec=1587782603, tv_usec=515150}}, {cmsg_len=28, cmsg_level=SOL_SOCKET, cmsg_type=SCM_CREDENTIALS, cmsg_data={pid=26270, uid=102, gid=106}}], msg_controllen=64, msg_flags=0}, MSG_DONTWAIT) = 131 <0.000024>
26285 1587782611.068311 recvmsg(3, {msg_name=NULL, msg_namelen=0, msg_iov=[{iov_base="<30>Apr 25 02:43:31 signalfx-age"..., iov_len=65536}], msg_iovlen=1, msg_control=[{cmsg_len=32, cmsg_level=SOL_SOCKET, cmsg_type=SCM_TIMESTAMP, cmsg_data={tv_sec=1587782611, tv_usec=67821}}, {cmsg_len=28, cmsg_level=SOL_SOCKET, cmsg_type=SCM_CREDENTIALS, cmsg_data={pid=1221, uid=998, gid=998}}], msg_controllen=64, msg_flags=0}, MSG_DONTWAIT) = 248 <0.000024>
26292 1587782613.522917 socket(AF_INET, SOCK_STREAM, IPPROTO_TCP) = 27 <0.000042>
26292 1587782613.525396 connect(27, {sa_family=AF_INET, sin_port=htons(10516), sin_addr=inet_addr("10.16.4.122")}, 16) = -1 EHOSTUNREACH (No route to host) <3.077384>
26270 1587782616.602915 --- SIGTTOU {si_signo=SIGTTOU, si_code=SI_USER, si_pid=26270, si_uid=102} ---
26270 1587782616.603021 sendto(13, "<43>Apr 25 02:43:36 rsyslogd: ca"..., 131, MSG_NOSIGNAL, NULL, 0) = 131 <0.000028>
26285 1587782616.603133 recvmsg(6, {msg_name=NULL, msg_namelen=0, msg_iov=[{iov_base="<43>Apr 25 02:43:36 rsyslogd: ca"..., iov_len=65536}], msg_iovlen=1, msg_control=[{cmsg_len=32, cmsg_level=SOL_SOCKET, cmsg_type=SCM_TIMESTAMP, cmsg_data={tv_sec=1587782616, tv_usec=603068}}, {cmsg_len=28, cmsg_level=SOL_SOCKET, cmsg_type=SCM_CREDENTIALS, cmsg_data={pid=26270, uid=102, gid=106}}], msg_controllen=64, msg_flags=0}, MSG_DONTWAIT) = 131 <0.000023>
26285 1587782621.070923 recvmsg(3, {msg_name=NULL, msg_namelen=0, msg_iov=[{iov_base="<30>Apr 25 02:43:41 signalfx-age"..., iov_len=65536}], msg_iovlen=1, msg_control=[{cmsg_len=32, cmsg_level=SOL_SOCKET, cmsg_type=SCM_TIMESTAMP, cmsg_data={tv_sec=1587782621, tv_usec=70743}}, {cmsg_len=28, cmsg_level=SOL_SOCKET, cmsg_type=SCM_CREDENTIALS, cmsg_data={pid=1221, uid=998, gid=998}}], msg_controllen=64, msg_flags=0}, MSG_DONTWAIT) = 248 <0.000016>
26285 1587782622.110768 recvmsg(6, {msg_name=NULL, msg_namelen=0, msg_iov=[{iov_base="<85>Apr 25 02:43:42 sudo: khursh"..., iov_len=65536}], msg_iovlen=1, msg_control=[{cmsg_len=32, cmsg_level=SOL_SOCKET, cmsg_type=SCM_TIMESTAMP, cmsg_data={tv_sec=1587782622, tv_usec=109874}}, {cmsg_len=28, cmsg_level=SOL_SOCKET, cmsg_type=SCM_CREDENTIALS, cmsg_data={pid=6463, uid=0, gid=238000513}}], msg_controllen=64, msg_flags=0}, MSG_DONTWAIT) = 123 <0.000024>
...
```

As for `rsyslog.log`, it just had information about the successful start of the service. No errors. No re-connection attempts.

**As you can see, Rsyslog kept sending messages till 02:43:07 (1587782587), at least. But the FIN signal had been received 02:27:23. I am not quite sure where the problem was - in Rsyslog or the Kernel level.**

## Steps to reproduce the behavior

I assume that the earlier information would be sufficient to reproduce the issue.

## Environment
- rsyslog version: 8.2002.0
- logstash version: 7.6.2
- platform: Ubuntu 18.04

### Rsyslog configuration

I am using the following configuration for the _omfwd_ module:

```
action(
    type="omfwd"
    Target="ip-10-16-4-122.ec2.internal"
    Port="10516"
    Protocol="tcp"
    template="default"

    RebindInterval="1000"

    KeepAlive="on"
    KeepAlive.Probes="3"
    KeepAlive.Interval="15"
    KeepAlive.Time="30"

    queue.dequeueBatchSize="100"
    queue.discardmark="4000"
    queue.discardseverity="3"
    queue.filename="q_default"
    queue.highwatermark="3000"
    queue.lowwatermark="250"
    queue.maxdiskspace="50m"
    queue.saveonshutdown="on"
    queue.size="5000"
    queue.type="LinkedList"

    action.reportSuspension="on"
    action.reportSuspensionContinuation="on"
    action.resumeInterval="10"
    action.resumeRetryCount="-1"
)
```

**Comment by khfayzullaev** [comment]
A quick update. To make sure that the issue was not related to Logstash, I tested different settings by using a sidecar proxy (Envoy and NGINX) on the Rsyslog instance. 

The sidecar proxy was able to properly handle the connection closure with Logstash (when the last one got terminated). And at the same time, it properly closed connection with Rsyslog.

So, I do suspect that the aforementioned issue is specifically related to Rsyslog handling half closed connections.

**Comment by kagarwal06** [comment]
I am facing a similar issue.
Client: Ubuntu machine using rsyslog
Server: Application running on ec2 machine behind NLB

When application on one of the ec2 instance closes the  connection, client receives `FIN` packet and in return it send `ACK`. Client then sends `PUSH ACK`, and receives `RST` from the server(the data is lost here). Rsyslog now reconnects and starts sending the data to a different node.
Ideally, after receiving `FIN`, the connection should be closed from the client side as well.
Is this an expected behaviour, or it can be fixed by modifying rsyslog config?

**Comment by khfayzullaev** [comment]
@kagarwal06, I can’t say what behavior is expected in your case. However, I eventually abandoned the TCP settings and switched to [RELP](https://www.rsyslog.com/doc/v8-stable/configuration/modules/omrelp.html). It has been pretty stable so far. I have more than 10 instances that send logs to the cluster of Logstash instances located behind the NLB. They use the RELP input [plugin](https://www.elastic.co/guide/en/logstash/current/plugins-inputs-relp.html).

**Comment by kagarwal06** [comment]
@khfayzullaev Thanks for the suggestion. I am trying that out.
Also, I have mentioned my complete issue [here](https://stackoverflow.com/questions/62716520/client-sends-ack-then-push-ack-after-receiving-fin-ack-from-server). It would be helpful if you could take a look at it. Thanks.

**Comment by konstantin-kornienko-epam** [comment]
We faced this issue too. Any other workarounds besides RELP? Thanks!

**Comment by khfayzullaev** [comment]
@konstantin-kornienko-epam , depending on what kind of proxy you are using, you may want to configure `net.ipv4.tcp_keepalive_time` on the Logstash side. If you are using AWS NLB, make sure you tune this parameter to well under 350s to avoid NLB timeouts ([ref](https://medium.com/tenable-techblog/lessons-from-aws-nlb-timeouts-5028a8f65dda)).

**Comment by qdongxu** [comment]
Here's a case that occurs on the loopback interface. 

Here's the connection states:
```shell
tcp        0      0 127.0.0.1:6514          0.0.0.0:*               LISTEN      4026230/telegraf
tcp        0      0 127.0.0.1:6514          127.0.0.1:33558         FIN_WAIT2   -
tcp        1      0 127.0.0.1:33558         127.0.0.1:6514          CLOSE_WAIT  2750519/rsyslogd
```

1. Linux kernel version:
```shell 
uname -a
Linux t03 5.4.0-1029-aws #30-Ubuntu SMP Tue Oct 20 10:06:38 UTC 2020 x86_64 x86_64 x86_64 GNU/Linux
```

2. telegraf version:

```shell
% telegraf version
Telegraf 1.22.0 (git: HEAD 80a7feb8)
```


2. rsyslogd version:
```shell
% rsyslogd -N1
rsyslogd: version 8.2001.0, config validation run (level 1), master config /etc/rsyslog.conf
rsyslogd: End of config validation run. Bye.
```

4. rsyslog config for telegraf
```shell
% cat  /etc/rsyslog.d/50-telegraf.conf
$ActionQueueType LinkedList # use asynchronous processing
$ActionQueueFileName srvrfwd # set file name, also enables disk mode
$ActionResumeRetryCount -1 # infinite retries on insert failure
$ActionQueueSaveOnShutdown on # save in-memory data if rsyslog shuts down

# forward over tcp with octet framing according to RFC 5425
*.* @@(o)127.0.0.1:6514;RSYSLOG_SyslogProtocol23Format

# uncomment to use udp according to RFC 5424
#*.* @127.0.0.1:6514;RSYSLOG_SyslogProtocol23Format
```

5. telegraf config:
```toml
[[inputs.syslog]]
    server = "tcp4://localhost:6514"
    fieldpass = ["message"]
    [inputs.syslog.tags]
        tags = "_metrics"
        host_name = "t03"
        instance = "t03"
        category = "infrastructure"
        log_type = "syslog"
        service = "t03"
```

**Comment by rgerhards** [comment]
Sorry for the very late follow-up. This answer may no longer help the original reporters, but it should help people finding the report through search and lets us resolve the backlog item on current evidence. I am not closing this merely because of its age.\n\nCurrent plain-TCP teardown was changed by commit 49a56d98746e7550472a7c6fa8e2062e6a3ca162. Normal close now performs `shutdown(SHUT_WR)`, drains peer data without blocking, and then closes; the abortive close path is reserved for explicit error/timeout aborts. This directly addresses the half-close/CLOSE_WAIT and FIN-then-write behavior documented in this thread, and favors graceful delivery rather than leaving the connection in the old state.\n\nThe switch to RELP reported above remains the stronger choice when application-level delivery acknowledgement matters. I am closing the plain-TCP lifecycle report as fixed. If a current release still leaves a connection in CLOSE_WAIT after receiving FIN, please open a new issue with current version, minimal omfwd config, and packet/state trace.

**Comment by rgerhards** [comment]
Correction after checking the actual `main` ancestry and TCP paths: commit `49a56d987`, which I cited as the fix, is not merged into `main`; it exists on `origin/tcp-linger`. Moreover, that change alters how rsyslog closes its side of a connection. It does not by itself establish prompt detection of a peer FIN, which is the CLOSE_WAIT behavior reported here. Current `main` still relies on the existing optional plain-TCP connection check and send-error path.

Apologies for citing an unmerged and non-equivalent change. This remains a plausible current TCP lifecycle bug and I am reopening it.
