### ISSUE TITLE
imrelp: server does not send FIN to client leaves socket in CLOSE_WAIT after blank tcp connect/disconnect

### ISSUE THREAD

**Issue by mabobr** [rsyslog/rsyslog#4358]
HI,
 compiled rsyslog 8.2006 + librelp 1.6.0.
 connecting  to imrelp and close connection afterwards leaves server's socket in CLOSE_WAIT status forever, no FIN packet from server side seen. When repeating (e.g. for port monitoring purposes) can lead to file descriptors exhaustion. (DoS condition)

```
18:25:45.718914 IP 127.0.0.1.32878 > 127.0.0.1.55555: Flags [S], seq 2634663643, win 43690, options [mss 65495,sackOK,TS val 172948473 ecr 0,nop,wscale 7], length 0
18:25:45.718926 IP 127.0.0.1.55555 > 127.0.0.1.32878: Flags [S.], seq 2796583234, ack 2634663644, win 43690, options [mss 65495,sackOK,TS val 172948473 ecr 172948473,nop,wscale 7], length 0
18:25:45.718934 IP 127.0.0.1.32878 > 127.0.0.1.55555: Flags [.], ack 1, win 342, options [nop,nop,TS val 172948473 ecr 172948473], length 0
18:25:48.080411 IP 127.0.0.1.32878 > 127.0.0.1.55555: Flags [F.], seq 1, ack 1, win 342, options [nop,nop,TS val 172949063 ecr 172948473], length 0
18:25:48.081886 IP 127.0.0.1.55555 > 127.0.0.1.32878: Flags [.], ack 2, win 342, options [nop,nop,TS val 172949064 ecr 172949063], length 0
Here FIN from server 127.0.0.1.55555 is expcted.
```
```
module(load="imrelp")

ruleset( name="i_imrelp_test" ){
         action( type="omfile" file="/dev/null" )
         stop
}
input(type="imrelp" port="55555" ruleset="i_imrelp_test")
```
```sbin/rsyslogd -f /tmp/imrelp.conf -dn -i NONE```
then telnet 127.0.0.1 55555

last debug event is: imrelp.c       : imrelp.c: librelp: doing epoll_wait
 ths for feedback

m.

**Comment by mabobr** [comment]
seems to be dup of  #4350
