### ISSUE TITLE
TLS error/corruption

### ISSUE THREAD

**Issue by alexadriaanse** [rsyslog/rsyslog#1043]
I'm running rsyslog 8.18.0 (8.18.0-1) package from the Adiscon Debian Wheezy repository with libgnutls26 2.12.20-8+deb7u5 inside of a Docker container, setup to log to Loggly via TCP/TLS. This rsyslog instance typically writes a batch of about 13 lines to Loggly once every hour, and writes nothing else in between those batches, so the TCP connection sits idle most of the time. I've noticed that when a batch is being written (after the connection has been idle for a while), the first line shows up on Loggly, the next few lines get dropped, and the remaining lines show up OK. I've also occasionally seen some garbage getting appended to some of the lines in Loggly and/or some messages getting repeated within the same line, e.g.:

```
<message>?Rl=???g???<133>0 2016-05-18T18:37:59.540617+00:00 69b4af5ba573 <service_tag> - - [<loggly_token>@41058 tag="<host_tag>"] <same_message_repeated>??tI?Ms???w?;?.??????????????????????????????????????????????????????????????????????????????????????????????????????????????????????????????????????????????????????
```

I'm speculating that when rsyslog writes the first line, some invalid data gets included, which Loggly acknowledges and stores but then terminates the connection, which causes the next few lines to get lost until the connection is reestablished.

In the [rsyslog debug log](https://github.com/rsyslog/rsyslog/files/271282/rsyslog_debug.txt), the following  GnuTLS messages stand out:

```
6683.659370957:action 0 queue:Reg/w0: omfwd: add 263 bytes to send buffer (curr offs 0)
6683.659557895:action 0 queue:Reg/w0: omfwd: add 257 bytes to send buffer (curr offs 263)
6683.660624237:action 0 queue:Reg/w0: GnuTLS log msg, level 2: errno: 32
6683.660913187:action 0 queue:Reg/w0: GnuTLS log msg, level 2: ASSERT: gnutls_buffers.c:431
6683.661061975:action 0 queue:Reg/w0: GnuTLS log msg, level 2: ASSERT: gnutls_buffers.c:755
6683.661468391:action 0 queue:Reg/w0: GnuTLS log msg, level 2: ASSERT: gnutls_record.c:491
6683.661985031:action 0 queue:Reg/w0: Called LogMsg, msg: unexpected GnuTLS error -53 in nsd_gtls.c:1640: Error in the push function.
6683.662168858:action 0 queue:Reg/w0: main Q: qqueueAdd: entry added, size now log 1, phys 1 entries
6683.662385713:action 0 queue:Reg/w0: main Q: EnqueueMsg advised worker start
6683.662567302:action 0 queue:Reg/w0: TCPSendBuf error -2078, destruct TCP Connection!
6683.662932911:action 0 queue:Reg/w0: GnuTLS log msg, level 2: errno: 32
6683.663151597:action 0 queue:Reg/w0: GnuTLS log msg, level 2: ASSERT: gnutls_buffers.c:431
6683.663333917:action 0 queue:Reg/w0: GnuTLS log msg, level 2: ASSERT: gnutls_buffers.c:755
6683.663578447:action 0 queue:Reg/w0: GnuTLS log msg, level 2: ASSERT: gnutls_record.c:238
```

tcpdump shows the following:

```
18:32:00.735007 IP ec2-54-236-68-122.compute-1.amazonaws.com.syslog-tls > test-docker-1-a.32860: Flags [P.], seq 2099:2152, ack 641, win 130, options [nop,nop,TS val 511487229 ecr 153041185], length 53
18:32:00.772177 IP test-docker-1-a.32860 > ec2-54-236-68-122.compute-1.amazonaws.com.syslog-tls: Flags [.], ack 2152, win 260, options [nop,nop,TS val 153341195 ecr 511487229], length 0
18:37:59.543413 IP test-docker-1-a.32860 > ec2-54-236-68-122.compute-1.amazonaws.com.syslog-tls: Flags [P.], seq 641:1094, ack 2152, win 260, options [nop,nop,TS val 153430887 ecr 511487229], length 453
18:37:59.545088 IP ec2-54-236-68-122.compute-1.amazonaws.com.syslog-tls > test-docker-1-a.32860: Flags [.], ack 1094, win 139, options [nop,nop,TS val 511576931 ecr 153430887], length 0
18:38:02.474607 IP test-docker-1-a.32860 > ec2-54-236-68-122.compute-1.amazonaws.com.syslog-tls: Flags [P.], seq 1094:1435, ack 2152, win 260, options [nop,nop,TS val 153431620 ecr 511576931], length 341
18:38:02.476072 IP ec2-54-236-68-122.compute-1.amazonaws.com.syslog-tls > test-docker-1-a.32860: Flags [.], ack 1435, win 147, options [nop,nop,TS val 511577664 ecr 153431620], length 0
18:38:02.476258 IP ec2-54-236-68-122.compute-1.amazonaws.com.syslog-tls > test-docker-1-a.32860: Flags [F.], seq 2152, ack 1435, win 147, options [nop,nop,TS val 511577664 ecr 153431620], length 0
18:38:02.477257 IP test-docker-1-a.32860 > ec2-54-236-68-122.compute-1.amazonaws.com.syslog-tls: Flags [P.], seq 1435:1952, ack 2153, win 260, options [nop,nop,TS val 153431621 ecr 511577664], length 517
18:38:02.478705 IP ec2-54-236-68-122.compute-1.amazonaws.com.syslog-tls > test-docker-1-a.32860: Flags [R], seq 1639464301, win 0, length 0
18:38:03.686749 IP test-docker-1-a.45848 > ec2-52-73-201-133.compute-1.amazonaws.com.syslog-tls: Flags [S], seq 3188389573, win 29200, options [mss 1460,sackOK,TS val 153431923 ecr 0,nop,wscale 7], length 0
18:38:03.688331 IP ec2-52-73-201-133.compute-1.amazonaws.com.syslog-tls > test-docker-1-a.45848: Flags [S.], seq 3442022609, ack 3188389574, win 14480, options [mss 1460,sackOK,TS val 509883234 ecr 153431923,nop,wscale 7], length 0
18:38:03.688379 IP test-docker-1-a.45848 > ec2-52-73-201-133.compute-1.amazonaws.com.syslog-tls: Flags [.], ack 1, win 229, options [nop,nop,TS val 153431924 ecr 509883234], length 0
18:38:03.688798 IP test-docker-1-a.45848 > ec2-52-73-201-133.compute-1.amazonaws.com.syslog-tls: Flags [P.], seq 1:118, ack 1, win 229, options [nop,nop,TS val 153431924 ecr 509883234], length 117
18:38:03.690306 IP ec2-52-73-201-133.compute-1.amazonaws.com.syslog-tls > test-docker-1-a.45848: Flags [.], ack 118, win 114, options [nop,nop,TS val 509883235 ecr 153431924], length 0
...
```

I've posted our [rsyslog.conf](https://github.com/rsyslog/rsyslog/files/271283/rsyslog.conf.txt) file.

Any ideas?

**Comment by alorbach** [comment]
Do you know which gnutls version is involved on the rsyslog side and what is used in Loggly?

**Comment by rgerhards** [comment]
seems to be no longer of interest
