### ISSUE TITLE
action.resumeIntervalMax does not work as expected

### ISSUE THREAD

**Issue by mblank123** [rsyslog/rsyslog#5097]
### Expected behavior
sending messages to two servers:
192.168.48.30
192.168.48.31  this server is intentionally down
I would expect rsyslogd to send SYN flag to this server (192.168.48.31) every 10 secs since rsyslog.conf contains
  action.resumeInterval="10" action.resumeIntervalMax="10"
  
  How to get rsyslogd sending SYN flag every 10 seconds to an inactive server?

### Actual behavior
SYN flag is sent with a break reaching 30secs now. I noticed it was earlier 20 secs.

06:01:47.812140 IP destrom1vm020.42348 > 192.168.48.31.syslog-conn: Flags [S], seq 1749692837, win 26730, options [mss 8910,nop,nop,sackOK,nop,wscale 7], length 0
06:02:17.084135 IP destrom1vm020.43326 > 192.168.48.31.syslog-conn: Flags [S], seq 3888618084, win 26730, options [mss 8910,nop,nop,sackOK,nop,wscale 7], length 0
06:02:18.096079 IP destrom1vm020.43326 > 192.168.48.31.syslog-conn: Flags [S], seq 3888618084, win 26730, options [mss 8910,nop,nop,sackOK,nop,wscale 7], length 0
06:02:28.106353 IP destrom1vm020.43732 > 192.168.48.31.syslog-conn: Flags [S], seq 1808667578, win 26730, options [mss 8910,nop,nop,sackOK,nop,wscale 7], length 0
06:02:38.115924 IP destrom1vm020.44058 > 192.168.48.31.syslog-conn: Flags [S], seq 757018274, win 26730, options [mss 8910,nop,nop,sackOK,nop,wscale 7], length 0
06:03:08.698097 IP destrom1vm020.45116 > 192.168.48.31.syslog-conn: Flags [S], seq 3926544835, win 26730, options [mss 8910,nop,nop,sackOK,nop,wscale 7], length 0
06:03:18.710901 IP destrom1vm020.45444 > 192.168.48.31.syslog-conn: Flags [S], seq 2616296023, win 26730, options [mss 8910,nop,nop,sackOK,nop,wscale 7], length 0
06:03:28.721145 IP destrom1vm020.45770 > 192.168.48.31.syslog-conn: Flags [S], seq 1585821903, win 26730, options [mss 8910,nop,nop,sackOK,nop,wscale 7], length 0
06:03:59.058226 IP destrom1vm020.46818 > 192.168.48.31.syslog-conn: Flags [S], seq 958432686, win 26730, options [mss 8910,nop,nop,sackOK,nop,wscale 7], length 0
06:04:09.070717 IP destrom1vm020.47192 > 192.168.48.31.syslog-conn: Flags [S], seq 3868505538, win 26730, options [mss 8910,nop,nop,sackOK,nop,wscale 7], length 0
06:04:19.080749 IP destrom1vm020.47536 > 192.168.48.31.syslog-conn: Flags [S], seq 3075647261, win 26730, options [mss 8910,nop,nop,sackOK,nop,wscale 7], length 0
06:04:49.418913 IP destrom1vm020.48580 > 192.168.48.31.syslog-conn: Flags [S], seq 2138266086, win 26730, options [mss 8910,nop,nop,sackOK,nop,wscale 7], length 0
06:04:59.431258 IP destrom1vm020.48910 > 192.168.48.31.syslog-conn: Flags [S], seq 1014639492, win 26730, options [mss 8910,nop,nop,sackOK,nop,wscale 7], length 0
06:05:09.441613 IP destrom1vm020.49236 > 192.168.48.31.syslog-conn: Flags [S], seq 3432524949, win 26730, options [mss 8910,nop,nop,sackOK,nop,wscale 7], length 0
06:05:39.781585 IP destrom1vm020.50280 > 192.168.48.31.syslog-conn: Flags [S], seq 383702931, win 26730, options [mss 8910,nop,nop,sackOK,nop,wscale 7], length 0

### Steps to reproduce the behavior
Have two servers to send messages, and put one server down.

### Environment
- rsyslog version: 
rsyslogd  8.2102.0-5.el8 (aka 2021.02) compiled with:
        PLATFORM:                               x86_64-redhat-linux-gnu
        PLATFORM (lsb_release -d):
        FEATURE_REGEXP:                         Yes
        GSSAPI Kerberos 5 support:              Yes
        FEATURE_DEBUG (debug build, slow code): No
        32bit Atomic operations supported:      Yes
        64bit Atomic operations supported:      Yes
        memory allocator:                       system default
        Runtime Instrumentation (slow code):    No
        uuid support:                           Yes
        systemd support:                        Yes
        Config file:                            /etc/rsyslog.conf
        PID file:                               /var/run/rsyslogd.pid
        Number of Bits in RainerScript integers: 64

- platform: Linux rhel 4.18.0-348.23.1.el8_5.x86_64
- for configuration questions/issues, include rsyslog.conf and included config files
rsyslog.conf:

# Forward messages to running SCM
call forwarding2SCM
ruleset(name="forwarding2SCM" queue.type="linkedList" queue.filename="fwdq" queue.MaxDiskSpace="50m") {
    action(type="omfwd" target="192.168.48.30" port="601" protocol="tcp" RebindInterval="100" action.resumeInterval="10" action.resumeIntervalMax="10" action.resumeRetryCount="2")
    action(type="omfwd" target="192.168.48.31" port="601" protocol="tcp" RebindInterval="100" action.resumeInterval="10" action.resumeIntervalMax="10" action.resumeRetryCount="2")
}

**Comment by rgerhards** [comment]
That bug was addressed on 2023‑06‑29 in commit 80e8a391bbfef55a5ab010fa76f88a1b861ba23e which corrected a case mismatch for the parameter name. The current repository already includes this fix.
